2025-06-09T13:11:32.845Z 🚀 === Complete Quiz Migration Process Started (v4.0) ===
2025-06-09T13:11:32.846Z 🗄️ === Database Schema Setup ===
2025-06-09T13:11:33.467Z ✅ ✅ Database schema verification completed - tables exist
2025-06-09T13:11:33.467Z 🚀 === Starting Quiz Data Migration ===
2025-06-09T13:11:33.469Z 🚀 Upserting quiz - ID: azure-a102, Tag: azure-a102, Topic: Azure AI Engineer Associate (AI-102)
2025-06-09T13:11:33.469Z 🚀 Upserting 1 rows into quizzes in 1 chunks...
2025-06-09T13:11:33.826Z ✅ ✓ Finished upserting to quizzes.
2025-06-09T13:11:33.829Z 🚀 Loaded 147 total questions from 7 JSON files.
2025-06-09T13:11:33.829Z 🚀 Prepared 147 questions with quiz_tag: azure-a102
2025-06-09T13:11:33.830Z 🚀 Upserting 147 rows into questions in 1 chunks...
2025-06-09T13:11:34.374Z ✅ ✓ Finished upserting to questions.
2025-06-09T13:11:34.376Z 🚀 Prepared 21 rows for drag_and_drop_targets
2025-06-09T13:11:34.376Z 🚀 Prepared 39 rows for drag_and_drop_options
2025-06-09T13:11:34.376Z 🚀 Prepared 21 rows for drag_and_drop_correct_pairs
2025-06-09T13:11:34.376Z 🚀 Prepared 28 rows for dropdown_selection_options
2025-06-09T13:11:34.376Z 🚀 Prepared 9 rows for dropdown_selection_targets
2025-06-09T13:11:34.376Z 🚀 Prepared 111 rows for multi_options
2025-06-09T13:11:34.376Z 🚀 Prepared 53 rows for multi_correct_answers
2025-06-09T13:11:34.376Z 🚀 Prepared 267 rows for single_selection_options
2025-06-09T13:11:34.376Z 🚀 Prepared 67 rows for single_selection_correct_answer
2025-06-09T13:11:34.376Z 🚀 Prepared 107 rows for order_items
2025-06-09T13:11:34.376Z 🚀 Prepared 60 rows for order_correct_order
2025-06-09T13:11:34.376Z 🚀 Prepared 17 rows for yes_no_answer
2025-06-09T13:11:34.376Z 🚀 Prepared 23 rows for yesno_multi_statements
2025-06-09T13:11:34.376Z 🚀 Prepared 23 rows for yesno_multi_correct_answers
2025-06-09T13:11:34.376Z 🚀 === Upserting child table data ===
2025-06-09T13:11:34.376Z 🚀 Upserting 21 rows into drag_and_drop_targets in 1 chunks...
2025-06-09T13:11:34.376Z 🚀 Upserting 39 rows into drag_and_drop_options in 1 chunks...
2025-06-09T13:11:34.376Z 🚀 Upserting 28 rows into dropdown_selection_options in 1 chunks...
2025-06-09T13:11:34.376Z 🚀 Upserting 9 rows into dropdown_selection_targets in 1 chunks...
2025-06-09T13:11:34.377Z 🚀 Upserting 111 rows into multi_options in 1 chunks...
2025-06-09T13:11:34.377Z 🚀 Upserting 267 rows into single_selection_options in 1 chunks...
2025-06-09T13:11:34.377Z 🚀 Upserting 107 rows into order_items in 1 chunks...
2025-06-09T13:11:34.377Z 🚀 Upserting 17 rows into yes_no_answer in 1 chunks...
2025-06-09T13:11:34.377Z 🚀 Upserting 23 rows into yesno_multi_statements in 1 chunks...
2025-06-09T13:11:34.545Z ✅ ✓ Finished upserting to yes_no_answer.
2025-06-09T13:11:34.579Z ✅ ✓ Finished upserting to single_selection_options.
2025-06-09T13:11:34.661Z ✅ ✓ Finished upserting to drag_and_drop_options.
2025-06-09T13:11:34.726Z ✅ ✓ Finished upserting to drag_and_drop_targets.
2025-06-09T13:11:34.734Z ✅ ✓ Finished upserting to dropdown_selection_options.
2025-06-09T13:11:34.741Z ✅ ✓ Finished upserting to dropdown_selection_targets.
2025-06-09T13:11:34.751Z ✅ ✓ Finished upserting to multi_options.
2025-06-09T13:11:34.753Z ✅ ✓ Finished upserting to yesno_multi_statements.
2025-06-09T13:11:34.766Z ✅ ✓ Finished upserting to order_items.
2025-06-09T13:11:34.766Z 🚀 Upserting 21 rows into drag_and_drop_correct_pairs in 1 chunks...
2025-06-09T13:11:34.766Z 🚀 Upserting 53 rows into multi_correct_answers in 1 chunks...
2025-06-09T13:11:34.766Z 🚀 Upserting 67 rows into single_selection_correct_answer in 1 chunks...
2025-06-09T13:11:34.767Z 🚀 Upserting 60 rows into order_correct_order in 1 chunks...
2025-06-09T13:11:34.767Z 🚀 Upserting 23 rows into yesno_multi_correct_answers in 1 chunks...
2025-06-09T13:11:34.887Z ✅ ✓ Finished upserting to yesno_multi_correct_answers.
2025-06-09T13:11:34.889Z ✅ ✓ Finished upserting to order_correct_order.
2025-06-09T13:11:35.051Z ✅ ✓ Finished upserting to multi_correct_answers.
2025-06-09T13:11:35.058Z ✅ ✓ Finished upserting to drag_and_drop_correct_pairs.
2025-06-09T13:11:35.070Z ✅ ✓ Finished upserting to single_selection_correct_answer.
2025-06-09T13:11:35.070Z 🚀 === Final Validation ===
2025-06-09T13:11:35.070Z 🚀 === Validating Quiz Integrity for azure-a102 ===
2025-06-09T13:11:35.343Z ⚠️ Custom validation function not available, performing basic validation: Could not find the function public.validate_quiz_integrity(quiz_tag_param) in the schema cache
2025-06-09T13:11:35.343Z 🚀 Performing basic validation checks...
2025-06-09T13:11:35.740Z ✅ ✓ Found quiz: Azure AI-102: AI Engineer Associate Practice Quiz
2025-06-09T13:11:35.740Z ✅ ✓ Total questions: 147
2025-06-09T13:11:35.740Z 🚀   - drag_and_drop: 9 questions
2025-06-09T13:11:35.740Z 🚀   - dropdown_selection: 4 questions
2025-06-09T13:11:35.741Z 🚀   - multi: 24 questions
2025-06-09T13:11:35.741Z 🚀   - order: 19 questions
2025-06-09T13:11:35.741Z 🚀   - single_selection: 67 questions
2025-06-09T13:11:35.741Z 🚀   - yes_no: 17 questions
2025-06-09T13:11:35.741Z 🚀   - yesno_multi: 7 questions
2025-06-09T13:11:35.741Z ✅ === Complete Quiz Migration Process Finished Successfully ===
2025-06-09T13:11:35.741Z 🚀 Migration Summary:
    - Schema Setup: ✅ Completed
    - Quiz ID: azure-a102
    - Quiz Tag: azure-a102 
    - Quiz Topic: Azure AI Engineer Associate (AI-102)
    - Total Questions: 147
    - Child Tables Updated: 14
    - Validation: ✅ Completed
