2025-06-09T00:05:25.289Z 🚀 === Complete Quiz Migration Process Started (v4.0) ===
2025-06-09T00:05:25.290Z 🗄️ === Database Schema Setup ===
2025-06-09T00:05:25.983Z ✅ ✅ Database schema verification completed - tables exist
2025-06-09T00:05:25.983Z 🚀 === Starting Quiz Data Migration ===
2025-06-09T00:05:25.985Z 🚀 Upserting quiz - ID: azure-ai-102-practice-quiz, Tag: azure-a102, Topic: Azure AI Engineer Associate (AI-102)
2025-06-09T00:05:25.985Z 🚀 Upserting 1 rows into quizzes in 1 chunks...
2025-06-09T00:05:26.101Z ✅ ✓ Finished upserting to quizzes.
2025-06-09T00:05:26.104Z 🚀 Loaded 147 total questions from 7 JSON files.
2025-06-09T00:05:26.105Z 🚀 Prepared 147 questions with quiz_tag: azure-ai-102-practice-quiz
2025-06-09T00:05:26.105Z 🚀 Upserting 147 rows into questions in 1 chunks...
2025-06-09T00:05:26.429Z ✅ ✓ Finished upserting to questions.
2025-06-09T00:05:26.432Z 🚀 Prepared 21 rows for drag_and_drop_targets
2025-06-09T00:05:26.432Z 🚀 Prepared 39 rows for drag_and_drop_options
2025-06-09T00:05:26.432Z 🚀 Prepared 21 rows for drag_and_drop_correct_pairs
2025-06-09T00:05:26.432Z 🚀 Prepared 28 rows for dropdown_selection_options
2025-06-09T00:05:26.432Z 🚀 Prepared 9 rows for dropdown_selection_targets
2025-06-09T00:05:26.432Z 🚀 Prepared 111 rows for multi_options
2025-06-09T00:05:26.432Z 🚀 Prepared 53 rows for multi_correct_answers
2025-06-09T00:05:26.432Z 🚀 Prepared 267 rows for single_selection_options
2025-06-09T00:05:26.432Z 🚀 Prepared 67 rows for single_selection_correct_answer
2025-06-09T00:05:26.432Z 🚀 Prepared 107 rows for order_items
2025-06-09T00:05:26.432Z 🚀 Prepared 60 rows for order_correct_order
2025-06-09T00:05:26.432Z 🚀 Prepared 17 rows for yes_no_answer
2025-06-09T00:05:26.432Z 🚀 Prepared 23 rows for yesno_multi_statements
2025-06-09T00:05:26.432Z 🚀 Prepared 23 rows for yesno_multi_correct_answers
2025-06-09T00:05:26.432Z 🚀 === Upserting child table data ===
2025-06-09T00:05:26.432Z 🚀 Upserting 21 rows into drag_and_drop_targets in 1 chunks...
2025-06-09T00:05:26.432Z 🚀 Upserting 39 rows into drag_and_drop_options in 1 chunks...
2025-06-09T00:05:26.432Z 🚀 Upserting 28 rows into dropdown_selection_options in 1 chunks...
2025-06-09T00:05:26.432Z 🚀 Upserting 9 rows into dropdown_selection_targets in 1 chunks...
2025-06-09T00:05:26.432Z 🚀 Upserting 111 rows into multi_options in 1 chunks...
2025-06-09T00:05:26.433Z 🚀 Upserting 267 rows into single_selection_options in 1 chunks...
2025-06-09T00:05:26.433Z 🚀 Upserting 107 rows into order_items in 1 chunks...
2025-06-09T00:05:26.434Z 🚀 Upserting 17 rows into yes_no_answer in 1 chunks...
2025-06-09T00:05:26.434Z 🚀 Upserting 23 rows into yesno_multi_statements in 1 chunks...
2025-06-09T00:05:26.561Z ✅ ✓ Finished upserting to drag_and_drop_options.
2025-06-09T00:05:26.598Z ✅ ✓ Finished upserting to yes_no_answer.
2025-06-09T00:05:26.611Z ✅ ✓ Finished upserting to dropdown_selection_options.
2025-06-09T00:05:26.619Z ✅ ✓ Finished upserting to yesno_multi_statements.
2025-06-09T00:05:26.623Z ✅ ✓ Finished upserting to drag_and_drop_targets.
2025-06-09T00:05:26.656Z ✅ ✓ Finished upserting to single_selection_options.
2025-06-09T00:05:26.759Z ✅ ✓ Finished upserting to dropdown_selection_targets.
2025-06-09T00:05:26.776Z ✅ ✓ Finished upserting to multi_options.
2025-06-09T00:05:26.788Z ✅ ✓ Finished upserting to order_items.
2025-06-09T00:05:26.788Z 🚀 Upserting 21 rows into drag_and_drop_correct_pairs in 1 chunks...
2025-06-09T00:05:26.788Z 🚀 Upserting 53 rows into multi_correct_answers in 1 chunks...
2025-06-09T00:05:26.789Z 🚀 Upserting 67 rows into single_selection_correct_answer in 1 chunks...
2025-06-09T00:05:26.789Z 🚀 Upserting 60 rows into order_correct_order in 1 chunks...
2025-06-09T00:05:26.789Z 🚀 Upserting 23 rows into yesno_multi_correct_answers in 1 chunks...
2025-06-09T00:05:26.924Z ✅ ✓ Finished upserting to yesno_multi_correct_answers.
2025-06-09T00:05:26.934Z ✅ ✓ Finished upserting to order_correct_order.
2025-06-09T00:05:26.935Z ✅ ✓ Finished upserting to drag_and_drop_correct_pairs.
2025-06-09T00:05:27.070Z ✅ ✓ Finished upserting to multi_correct_answers.
2025-06-09T00:05:27.080Z ✅ ✓ Finished upserting to single_selection_correct_answer.
2025-06-09T00:05:27.080Z 🚀 === Final Validation ===
2025-06-09T00:05:27.080Z 🚀 === Validating Quiz Integrity for azure-ai-102-practice-quiz ===
2025-06-09T00:05:27.357Z ⚠️ Custom validation function not available, performing basic validation: Could not find the function public.validate_quiz_integrity(quiz_tag_param) in the schema cache
2025-06-09T00:05:27.358Z 🚀 Performing basic validation checks...
2025-06-09T00:05:27.586Z ✅ ✓ Found quiz: Azure AI-102: AI Engineer Associate Practice Quiz
2025-06-09T00:05:27.586Z ✅ ✓ Total questions: 147
2025-06-09T00:05:27.587Z 🚀   - drag_and_drop: 9 questions
2025-06-09T00:05:27.587Z 🚀   - multi: 24 questions
2025-06-09T00:05:27.587Z 🚀   - dropdown_selection: 4 questions
2025-06-09T00:05:27.587Z 🚀   - order: 19 questions
2025-06-09T00:05:27.587Z 🚀   - single_selection: 67 questions
2025-06-09T00:05:27.587Z 🚀   - yes_no: 17 questions
2025-06-09T00:05:27.587Z 🚀   - yesno_multi: 7 questions
2025-06-09T00:05:27.587Z ✅ === Complete Quiz Migration Process Finished Successfully ===
2025-06-09T00:05:27.587Z 🚀 Migration Summary:
    - Schema Setup: ✅ Completed
    - Quiz ID: azure-ai-102-practice-quiz
    - Quiz Tag: azure-a102 
    - Quiz Topic: Azure AI Engineer Associate (AI-102)
    - Total Questions: 147
    - Child Tables Updated: 14
    - Validation: ✅ Completed
