2025-06-10T10:16:39.577Z 🚀 === Complete Quiz Migration Process Started (v4.0) ===
2025-06-10T10:16:39.578Z 🗄️ === Database Schema Setup ===
2025-06-10T10:16:40.101Z ✅ ✅ Database schema verification completed - tables exist
2025-06-10T10:16:40.102Z 🚀 === Starting Quiz Data Migration ===
2025-06-10T10:16:40.103Z 🚀 Upserting quiz - ID: azure-a102, Tag: azure-a102, Topic: Azure AI Engineer Associate (AI-102)
2025-06-10T10:16:40.103Z 🚀 Upserting 1 rows into quizzes in 1 chunks...
2025-06-10T10:16:40.236Z ✅ ✓ Finished upserting to quizzes.
2025-06-10T10:16:40.240Z 🚀 Loaded 147 total questions from 7 JSON files.
2025-06-10T10:16:40.242Z 🚀 Prepared 147 questions with quiz_tag: azure-a102
2025-06-10T10:16:40.242Z 🚀 Upserting 147 rows into questions in 1 chunks...
2025-06-10T10:16:40.863Z ✅ ✓ Finished upserting to questions.
2025-06-10T10:16:40.864Z 🚀 Prepared 21 rows for drag_and_drop_targets
2025-06-10T10:16:40.864Z 🚀 Prepared 39 rows for drag_and_drop_options
2025-06-10T10:16:40.864Z 🚀 Prepared 21 rows for drag_and_drop_correct_pairs
2025-06-10T10:16:40.864Z 🚀 Prepared 28 rows for dropdown_selection_options
2025-06-10T10:16:40.864Z 🚀 Prepared 9 rows for dropdown_selection_targets
2025-06-10T10:16:40.864Z 🚀 Prepared 111 rows for multi_options
2025-06-10T10:16:40.864Z 🚀 Prepared 53 rows for multi_correct_answers
2025-06-10T10:16:40.864Z 🚀 Prepared 267 rows for single_selection_options
2025-06-10T10:16:40.864Z 🚀 Prepared 67 rows for single_selection_correct_answer
2025-06-10T10:16:40.864Z 🚀 Prepared 107 rows for order_items
2025-06-10T10:16:40.864Z 🚀 Prepared 60 rows for order_correct_order
2025-06-10T10:16:40.864Z 🚀 Prepared 17 rows for yes_no_answer
2025-06-10T10:16:40.864Z 🚀 Prepared 23 rows for yesno_multi_statements
2025-06-10T10:16:40.864Z 🚀 Prepared 23 rows for yesno_multi_correct_answers
2025-06-10T10:16:40.864Z 🚀 === Upserting child table data ===
2025-06-10T10:16:40.864Z 🚀 Upserting 21 rows into drag_and_drop_targets in 1 chunks...
2025-06-10T10:16:40.864Z 🚀 Upserting 39 rows into drag_and_drop_options in 1 chunks...
2025-06-10T10:16:40.864Z 🚀 Upserting 28 rows into dropdown_selection_options in 1 chunks...
2025-06-10T10:16:40.864Z 🚀 Upserting 9 rows into dropdown_selection_targets in 1 chunks...
2025-06-10T10:16:40.864Z 🚀 Upserting 111 rows into multi_options in 1 chunks...
2025-06-10T10:16:40.864Z 🚀 Upserting 267 rows into single_selection_options in 1 chunks...
2025-06-10T10:16:40.865Z 🚀 Upserting 107 rows into order_items in 1 chunks...
2025-06-10T10:16:40.865Z 🚀 Upserting 17 rows into yes_no_answer in 1 chunks...
2025-06-10T10:16:40.865Z 🚀 Upserting 23 rows into yesno_multi_statements in 1 chunks...
2025-06-10T10:16:40.988Z ✅ ✓ Finished upserting to drag_and_drop_options.
2025-06-10T10:16:41.058Z ✅ ✓ Finished upserting to multi_options.
2025-06-10T10:16:41.182Z ✅ ✓ Finished upserting to dropdown_selection_options.
2025-06-10T10:16:41.206Z ✅ ✓ Finished upserting to order_items.
2025-06-10T10:16:41.261Z ✅ ✓ Finished upserting to yesno_multi_statements.
2025-06-10T10:16:41.283Z ✅ ✓ Finished upserting to yes_no_answer.
2025-06-10T10:16:41.293Z ✅ ✓ Finished upserting to dropdown_selection_targets.
2025-06-10T10:16:41.306Z ✅ ✓ Finished upserting to drag_and_drop_targets.
2025-06-10T10:16:41.331Z ✅ ✓ Finished upserting to single_selection_options.
2025-06-10T10:16:41.331Z 🚀 Upserting 21 rows into drag_and_drop_correct_pairs in 1 chunks...
2025-06-10T10:16:41.331Z 🚀 Upserting 53 rows into multi_correct_answers in 1 chunks...
2025-06-10T10:16:41.331Z 🚀 Upserting 67 rows into single_selection_correct_answer in 1 chunks...
2025-06-10T10:16:41.331Z 🚀 Upserting 60 rows into order_correct_order in 1 chunks...
2025-06-10T10:16:41.331Z 🚀 Upserting 23 rows into yesno_multi_correct_answers in 1 chunks...
2025-06-10T10:16:41.462Z ✅ ✓ Finished upserting to multi_correct_answers.
2025-06-10T10:16:41.636Z ✅ ✓ Finished upserting to yesno_multi_correct_answers.
2025-06-10T10:16:41.637Z ✅ ✓ Finished upserting to order_correct_order.
2025-06-10T10:16:41.643Z ✅ ✓ Finished upserting to drag_and_drop_correct_pairs.
2025-06-10T10:16:41.664Z ✅ ✓ Finished upserting to single_selection_correct_answer.
2025-06-10T10:16:41.664Z 🚀 === Final Validation ===
2025-06-10T10:16:41.665Z 🚀 === Validating Quiz Integrity for azure-a102 ===
2025-06-10T10:16:41.814Z ⚠️ Custom validation function not available, performing basic validation: Could not find the function public.validate_quiz_integrity(quiz_tag_param) in the schema cache
2025-06-10T10:16:41.814Z 🚀 Performing basic validation checks...
2025-06-10T10:16:42.042Z ✅ ✓ Found quiz: Azure AI-102: AI Engineer Associate Practice Quiz
2025-06-10T10:16:42.042Z ✅ ✓ Total questions: 294
2025-06-10T10:16:42.042Z 🚀   - drag_and_drop: 18 questions
2025-06-10T10:16:42.042Z 🚀   - dropdown_selection: 8 questions
2025-06-10T10:16:42.042Z 🚀   - multi: 48 questions
2025-06-10T10:16:42.042Z 🚀   - order: 38 questions
2025-06-10T10:16:42.042Z 🚀   - single_selection: 134 questions
2025-06-10T10:16:42.042Z 🚀   - yes_no: 34 questions
2025-06-10T10:16:42.042Z 🚀   - yesno_multi: 14 questions
2025-06-10T10:16:42.042Z ✅ === Complete Quiz Migration Process Finished Successfully ===
2025-06-10T10:16:42.042Z 🚀 Migration Summary:
    - Schema Setup: ✅ Completed
    - Quiz ID: azure-a102
    - Quiz Tag: azure-a102 
    - Quiz Topic: Azure AI Engineer Associate (AI-102)
    - Total Questions: 147
    - Child Tables Updated: 14
    - Validation: ✅ Completed
