2025-06-10T10:17:54.357Z 🚀 === Complete Quiz Migration Process Started (v4.0) ===
2025-06-10T10:17:54.358Z 🗄️ === Database Schema Setup ===
2025-06-10T10:17:54.646Z ✅ ✅ Database schema verification completed - tables exist
2025-06-10T10:17:54.647Z 🚀 === Starting Quiz Data Migration ===
2025-06-10T10:17:54.648Z 🚀 Upserting quiz - ID: azure-a102, Tag: azure-a102, Topic: Azure AI Engineer Associate (AI-102)
2025-06-10T10:17:54.648Z 🚀 Upserting 1 rows into quizzes in 1 chunks...
2025-06-10T10:17:54.767Z ✅ ✓ Finished upserting to quizzes.
2025-06-10T10:17:54.769Z 🚀 Loaded 147 total questions from 7 JSON files.
2025-06-10T10:17:54.770Z 🚀 Prepared 147 questions with quiz_tag: azure-a102
2025-06-10T10:17:54.770Z 🚀 Upserting 147 rows into questions in 1 chunks...
2025-06-10T10:17:55.109Z ✅ ✓ Finished upserting to questions.
2025-06-10T10:17:55.112Z 🚀 Prepared 21 rows for drag_and_drop_targets
2025-06-10T10:17:55.112Z 🚀 Prepared 39 rows for drag_and_drop_options
2025-06-10T10:17:55.112Z 🚀 Prepared 21 rows for drag_and_drop_correct_pairs
2025-06-10T10:17:55.112Z 🚀 Prepared 28 rows for dropdown_selection_options
2025-06-10T10:17:55.112Z 🚀 Prepared 9 rows for dropdown_selection_targets
2025-06-10T10:17:55.112Z 🚀 Prepared 111 rows for multi_options
2025-06-10T10:17:55.112Z 🚀 Prepared 53 rows for multi_correct_answers
2025-06-10T10:17:55.112Z 🚀 Prepared 267 rows for single_selection_options
2025-06-10T10:17:55.112Z 🚀 Prepared 67 rows for single_selection_correct_answer
2025-06-10T10:17:55.112Z 🚀 Prepared 107 rows for order_items
2025-06-10T10:17:55.112Z 🚀 Prepared 60 rows for order_correct_order
2025-06-10T10:17:55.112Z 🚀 Prepared 17 rows for yes_no_answer
2025-06-10T10:17:55.112Z 🚀 Prepared 23 rows for yesno_multi_statements
2025-06-10T10:17:55.112Z 🚀 Prepared 23 rows for yesno_multi_correct_answers
2025-06-10T10:17:55.112Z 🚀 === Upserting child table data ===
2025-06-10T10:17:55.112Z 🚀 Upserting 21 rows into drag_and_drop_targets in 1 chunks...
2025-06-10T10:17:55.112Z 🚀 Upserting 39 rows into drag_and_drop_options in 1 chunks...
2025-06-10T10:17:55.113Z 🚀 Upserting 28 rows into dropdown_selection_options in 1 chunks...
2025-06-10T10:17:55.113Z 🚀 Upserting 9 rows into dropdown_selection_targets in 1 chunks...
2025-06-10T10:17:55.113Z 🚀 Upserting 111 rows into multi_options in 1 chunks...
2025-06-10T10:17:55.113Z 🚀 Upserting 267 rows into single_selection_options in 1 chunks...
2025-06-10T10:17:55.113Z 🚀 Upserting 107 rows into order_items in 1 chunks...
2025-06-10T10:17:55.114Z 🚀 Upserting 17 rows into yes_no_answer in 1 chunks...
2025-06-10T10:17:55.114Z 🚀 Upserting 23 rows into yesno_multi_statements in 1 chunks...
2025-06-10T10:17:55.243Z ✅ ✓ Finished upserting to drag_and_drop_options.
2025-06-10T10:17:55.275Z ✅ ✓ Finished upserting to dropdown_selection_options.
2025-06-10T10:17:55.284Z ✅ ✓ Finished upserting to yes_no_answer.
2025-06-10T10:17:55.300Z ✅ ✓ Finished upserting to multi_options.
2025-06-10T10:17:55.307Z ✅ ✓ Finished upserting to yesno_multi_statements.
2025-06-10T10:17:55.443Z ✅ ✓ Finished upserting to dropdown_selection_targets.
2025-06-10T10:17:55.461Z ✅ ✓ Finished upserting to drag_and_drop_targets.
2025-06-10T10:17:55.466Z ✅ ✓ Finished upserting to order_items.
2025-06-10T10:17:55.477Z ✅ ✓ Finished upserting to single_selection_options.
2025-06-10T10:17:55.477Z 🚀 Upserting 21 rows into drag_and_drop_correct_pairs in 1 chunks...
2025-06-10T10:17:55.477Z 🚀 Upserting 53 rows into multi_correct_answers in 1 chunks...
2025-06-10T10:17:55.477Z 🚀 Upserting 67 rows into single_selection_correct_answer in 1 chunks...
2025-06-10T10:17:55.477Z 🚀 Upserting 60 rows into order_correct_order in 1 chunks...
2025-06-10T10:17:55.478Z 🚀 Upserting 23 rows into yesno_multi_correct_answers in 1 chunks...
2025-06-10T10:17:55.594Z ✅ ✓ Finished upserting to multi_correct_answers.
2025-06-10T10:17:55.596Z ✅ ✓ Finished upserting to yesno_multi_correct_answers.
2025-06-10T10:17:55.768Z ✅ ✓ Finished upserting to order_correct_order.
2025-06-10T10:17:55.770Z ✅ ✓ Finished upserting to single_selection_correct_answer.
2025-06-10T10:17:55.773Z ✅ ✓ Finished upserting to drag_and_drop_correct_pairs.
2025-06-10T10:17:55.773Z 🚀 === Final Validation ===
2025-06-10T10:17:55.773Z 🚀 === Validating Quiz Integrity for azure-a102 ===
2025-06-10T10:17:55.887Z ⚠️ Custom validation function not available, performing basic validation: Could not find the function public.validate_quiz_integrity(quiz_tag_param) in the schema cache
2025-06-10T10:17:55.887Z 🚀 Performing basic validation checks...
2025-06-10T10:17:56.116Z ✅ ✓ Found quiz: Azure AI-102: AI Engineer Associate Practice Quiz
2025-06-10T10:17:56.116Z ✅ ✓ Total questions: 147
2025-06-10T10:17:56.116Z 🚀   - drag_and_drop: 9 questions
2025-06-10T10:17:56.116Z 🚀   - multi: 24 questions
2025-06-10T10:17:56.116Z 🚀   - dropdown_selection: 4 questions
2025-06-10T10:17:56.116Z 🚀   - order: 19 questions
2025-06-10T10:17:56.116Z 🚀   - single_selection: 67 questions
2025-06-10T10:17:56.116Z 🚀   - yes_no: 17 questions
2025-06-10T10:17:56.116Z 🚀   - yesno_multi: 7 questions
2025-06-10T10:17:56.116Z ✅ === Complete Quiz Migration Process Finished Successfully ===
2025-06-10T10:17:56.116Z 🚀 Migration Summary:
    - Schema Setup: ✅ Completed
    - Quiz ID: azure-a102
    - Quiz Tag: azure-a102 
    - Quiz Topic: Azure AI Engineer Associate (AI-102)
    - Total Questions: 147
    - Child Tables Updated: 14
    - Validation: ✅ Completed
